;;;;;;;;;;;;;;;;;;;;;;;x;;;;;;;;;;;;;;;;;;;;;;;;;;;x
600005.T;Starting Literacy Fix for Vinland;;;;;;;;;;;;;;;;;;;;;;;x;;;;;;;;;;;;;;;;;;;;;;;;;;;x
600005.D;This event is made to nerf the literacy of Vinland's indigenous and Afro-Arcadian peoples;;;;;;;;;;;;;;;;;;;;;;;x;;;;;;;;;;;;;;;;;;;;;;;;;;;x
600005.A;Oh, that's a shame;;;;;;;;;;;;;;;;;;;;;;;x;;;;;;;;;;;;;;;;;;;;;;;;;;;x
600006.T;Starting Literacy Fix for Amazonie;;;;;;;;;;;;;;;;;;;;;;;x;;;;;;;;;;;;;;;;;;;;;;;;;;;x
600006.D;This event is made to buff the literacy of the Lotharian people in Amazonie to the same as in Lothringia;;;;;;;;;;;;;;;;;;;;;;;x;;;;;;;;;;;;;;;;;;;;;;;;;;;x
600006.A;I guess that's good?;;;;;;;;;;;;;;;;;;;;;;;x;;;;;;;;;;;;;;;;;;;;;;;;;;;x
